{"$id":"https://pyamplicol.dev/schema/report-cache-v3.json","$schema":"https://json-schema.org/draft/2020-12/schema","additionalProperties":false,"properties":{"$schema":{"const":"./report-cache.schema.json"},"dataset_id":{"minLength":1,"type":"string"},"entries":{"items":{"additionalProperties":false,"properties":{"cell_id":{"minLength":1,"type":"string"},"measurement":{"additionalProperties":false,"properties":{"artifact":{"type":["object","null"]},"execution_seconds_per_point":{"minimum":0,"type":["number","null"]},"failure":{"type":["object","null"]},"generation_seconds":{"minimum":0,"type":["number","null"]},"matrix_element":{"type":["number","string","null"]},"provenance":{"type":["object","null"]},"relative_standard_error":{"minimum":0,"type":["number","null"]},"resources":{"type":["object","null"]},"sample_count":{"minimum":1,"type":["integer","null"]},"selector_contract":{"type":["object","null"]},"standard_error_seconds_per_point":{"minimum":0,"type":["number","null"]},"status":{"enum":["not_available","ok","failed","timeout","memory_limit","skip","validation_failed","error","unsupported"]},"validation":{"type":["object","null"]},"wall_seconds_per_point":{"minimum":0,"type":["number","null"]}},"required":["status","generation_seconds","wall_seconds_per_point","execution_seconds_per_point","matrix_element","sample_count","standard_error_seconds_per_point","relative_standard_error","artifact","selector_contract","validation","resources","provenance","failure"],"type":"object"},"measurement_spec":{"type":"object"},"n_final":{"minimum":1,"type":"integer"},"process":{"minLength":1,"type":"string"},"process_key":{"type":["string","null"]},"variant":{"type":["string","null"]},"workload":{"enum":["selected-flow","all-flow","contracted"]}},"required":["cell_id","process_key","process","n_final","variant","workload","measurement_spec","measurement"],"type":"object"},"type":"array"},"kind":{"const":"performance_measurements"},"measurement_specs":{"items":{"type":"object"},"type":"array"},"report_version":{"const":"0.2.0"},"schema_version":{"const":3}},"required":["$schema","schema_version","report_version","kind","dataset_id","measurement_specs","entries"],"title":"pyAmpliCol three-mode performance cache","type":"object"}
