{"$schema":"./report-cache.schema.json","dataset_id":"matrix_recurrence_ufo_sm_full","entries":[{"cell_id":"matrix-recurrence-ufo-sm-full-n1-dd-z-jets-contracted","measurement":{"artifact":null,"execution_seconds_per_point":null,"failure":null,"generation_seconds":null,"matrix_element":null,"provenance":null,"relative_standard_error":null,"resources":null,"sample_count":null,"selector_contract":null,"standard_error_seconds_per_point":null,"status":"not_available","validation":null,"wall_seconds_per_point":null},"measurement_spec":{"accuracy":"full","backend":"jit","execution_mode":"recurrence","jit_optimization_level":2,"model":"ufo_sm"},"n_final":1,"process":"d d~ > z","process_key":"dd_z_jets","variant":null,"workload":"contracted"},{"cell_id":"matrix-recurrence-ufo-sm-full-n1-ud-w-jets-contracted","measurement":{"artifact":null,"execution_seconds_per_point":null,"failure":null,"generation_seconds":null,"matrix_element":null,"provenance":null,"relative_standard_error":null,"resources":null,"sample_count":null,"selector_contract":null,"standard_error_seconds_per_point":null,"status":"not_available","validation":null,"wall_seconds_per_point":null},"measurement_spec":{"accuracy":"full","backend":"jit","execution_mode":"recurrence","jit_optimization_level":2,"model":"ufo_sm"},"n_final":1,"process":"u d~ > w+","process_key":"ud_w_jets","variant":null,"workload":"contracted"},{"cell_id":"matrix-recurrence-ufo-sm-full-n2-dd-epem-jets-contracted","measurement":{"artifact":null,"execution_seconds_per_point":null,"failure":null,"generation_seconds":null,"matrix_element":null,"provenance":null,"relative_standard_error":null,"resources":null,"sample_count":null,"selector_contract":null,"standard_error_seconds_per_point":null,"status":"not_available","validation":null,"wall_seconds_per_point":null},"measurement_spec":{"accuracy":"full","backend":"jit","execution_mode":"recurrence","jit_optimization_level":2,"model":"ufo_sm"},"n_final":2,"process":"d d~ > e+ e-","process_key":"dd_epem_jets","variant":null,"workload":"contracted"},{"cell_id":"matrix-recurrence-ufo-sm-full-n2-dd-tt-jets-contracted","measurement":{"artifact":null,"execution_seconds_per_point":null,"failure":null,"generation_seconds":null,"matrix_element":null,"provenance":null,"relative_standard_error":null,"resources":null,"sample_count":null,"selector_contract":null,"standard_error_seconds_per_point":null,"status":"not_available","validation":null,"wall_seconds_per_point":null},"measurement_spec":{"accuracy":"full","backend":"jit","execution_mode":"recurrence","jit_optimization_level":2,"model":"ufo_sm"},"n_final":2,"process":"d d~ > t t~","process_key":"dd_tt_jets","variant":null,"workload":"contracted"},{"cell_id":"matrix-recurrence-ufo-sm-full-n2-dd-z-jets-contracted","measurement":{"artifact":null,"execution_seconds_per_point":null,"failure":null,"generation_seconds":null,"matrix_element":null,"provenance":null,"relative_standard_error":null,"resources":null,"sample_count":null,"selector_contract":null,"standard_error_seconds_per_point":null,"status":"not_available","validation":null,"wall_seconds_per_point":null},"measurement_spec":{"accuracy":"full","backend":"jit","execution_mode":"recurrence","jit_optimization_level":2,"model":"ufo_sm"},"n_final":2,"process":"d d~ > z g","process_key":"dd_z_jets","variant":null,"workload":"contracted"},{"cell_id":"matrix-recurrence-ufo-sm-full-n2-dd-zz-jets-contracted","measurement":{"artifact":null,"execution_seconds_per_point":null,"failure":null,"generation_seconds":null,"matrix_element":null,"provenance":null,"relative_standard_error":null,"resources":null,"sample_count":null,"selector_contract":null,"standard_error_seconds_per_point":null,"status":"not_available","validation":null,"wall_seconds_per_point":null},"measurement_spec":{"accuracy":"full","backend":"jit","execution_mode":"recurrence","jit_optimization_level":2,"model":"ufo_sm"},"n_final":2,"process":"d d~ > z z","process_key":"dd_zz_jets","variant":null,"workload":"contracted"},{"cell_id":"matrix-recurrence-ufo-sm-full-n2-gg-gluons-contracted","measurement":{"artifact":null,"execution_seconds_per_point":null,"failure":null,"generation_seconds":null,"matrix_element":null,"provenance":null,"relative_standard_error":null,"resources":null,"sample_count":null,"selector_contract":null,"standard_error_seconds_per_point":null,"status":"not_available","validation":null,"wall_seconds_per_point":null},"measurement_spec":{"accuracy":"full","backend":"jit","execution_mode":"recurrence","jit_optimization_level":2,"model":"ufo_sm"},"n_final":2,"process":"g g > g g","process_key":"gg_gluons","variant":null,"workload":"contracted"},{"cell_id":"matrix-recurrence-ufo-sm-full-n2-gg-tt-jets-contracted","measurement":{"artifact":null,"execution_seconds_per_point":null,"failure":null,"generation_seconds":null,"matrix_element":null,"provenance":null,"relative_standard_error":null,"resources":null,"sample_count":null,"selector_contract":null,"standard_error_seconds_per_point":null,"status":"not_available","validation":null,"wall_seconds_per_point":null},"measurement_spec":{"accuracy":"full","backend":"jit","execution_mode":"recurrence","jit_optimization_level":2,"model":"ufo_sm"},"n_final":2,"process":"g g > t t~","process_key":"gg_tt_jets","variant":null,"workload":"contracted"},{"cell_id":"matrix-recurrence-ufo-sm-full-n2-ud-epve-jets-contracted","measurement":{"artifact":null,"execution_seconds_per_point":null,"failure":null,"generation_seconds":null,"matrix_element":null,"provenance":null,"relative_standard_error":null,"resources":null,"sample_count":null,"selector_contract":null,"standard_error_seconds_per_point":null,"status":"not_available","validation":null,"wall_seconds_per_point":null},"measurement_spec":{"accuracy":"full","backend":"jit","execution_mode":"recurrence","jit_optimization_level":2,"model":"ufo_sm"},"n_final":2,"process":"u d~ > e+ ve","process_key":"ud_epve_jets","variant":null,"workload":"contracted"},{"cell_id":"matrix-recurrence-ufo-sm-full-n2-ud-w-jets-contracted","measurement":{"artifact":null,"execution_seconds_per_point":null,"failure":null,"generation_seconds":null,"matrix_element":null,"provenance":null,"relative_standard_error":null,"resources":null,"sample_count":null,"selector_contract":null,"standard_error_seconds_per_point":null,"status":"not_available","validation":null,"wall_seconds_per_point":null},"measurement_spec":{"accuracy":"full","backend":"jit","execution_mode":"recurrence","jit_optimization_level":2,"model":"ufo_sm"},"n_final":2,"process":"u d~ > w+ g","process_key":"ud_w_jets","variant":null,"workload":"contracted"},{"cell_id":"matrix-recurrence-ufo-sm-full-n3-dd-epem-jets-contracted","measurement":{"artifact":null,"execution_seconds_per_point":null,"failure":null,"generation_seconds":null,"matrix_element":null,"provenance":null,"relative_standard_error":null,"resources":null,"sample_count":null,"selector_contract":null,"standard_error_seconds_per_point":null,"status":"not_available","validation":null,"wall_seconds_per_point":null},"measurement_spec":{"accuracy":"full","backend":"jit","execution_mode":"recurrence","jit_optimization_level":2,"model":"ufo_sm"},"n_final":3,"process":"d d~ > e+ e- g","process_key":"dd_epem_jets","variant":null,"workload":"contracted"},{"cell_id":"matrix-recurrence-ufo-sm-full-n3-dd-tt-jets-contracted","measurement":{"artifact":null,"execution_seconds_per_point":null,"failure":null,"generation_seconds":null,"matrix_element":null,"provenance":null,"relative_standard_error":null,"resources":null,"sample_count":null,"selector_contract":null,"standard_error_seconds_per_point":null,"status":"not_available","validation":null,"wall_seconds_per_point":null},"measurement_spec":{"accuracy":"full","backend":"jit","execution_mode":"recurrence","jit_optimization_level":2,"model":"ufo_sm"},"n_final":3,"process":"d d~ > t t~ g","process_key":"dd_tt_jets","variant":null,"workload":"contracted"},{"cell_id":"matrix-recurrence-ufo-sm-full-n3-dd-z-jets-contracted","measurement":{"artifact":null,"execution_seconds_per_point":null,"failure":null,"generation_seconds":null,"matrix_element":null,"provenance":null,"relative_standard_error":null,"resources":null,"sample_count":null,"selector_contract":null,"standard_error_seconds_per_point":null,"status":"not_available","validation":null,"wall_seconds_per_point":null},"measurement_spec":{"accuracy":"full","backend":"jit","execution_mode":"recurrence","jit_optimization_level":2,"model":"ufo_sm"},"n_final":3,"process":"d d~ > z g g","process_key":"dd_z_jets","variant":null,"workload":"contracted"},{"cell_id":"matrix-recurrence-ufo-sm-full-n3-dd-zz-jets-contracted","measurement":{"artifact":null,"execution_seconds_per_point":null,"failure":null,"generation_seconds":null,"matrix_element":null,"provenance":null,"relative_standard_error":null,"resources":null,"sample_count":null,"selector_contract":null,"standard_error_seconds_per_point":null,"status":"not_available","validation":null,"wall_seconds_per_point":null},"measurement_spec":{"accuracy":"full","backend":"jit","execution_mode":"recurrence","jit_optimization_level":2,"model":"ufo_sm"},"n_final":3,"process":"d d~ > z z g","process_key":"dd_zz_jets","variant":null,"workload":"contracted"},{"cell_id":"matrix-recurrence-ufo-sm-full-n3-dd-zzz-jets-contracted","measurement":{"artifact":null,"execution_seconds_per_point":null,"failure":null,"generation_seconds":null,"matrix_element":null,"provenance":null,"relative_standard_error":null,"resources":null,"sample_count":null,"selector_contract":null,"standard_error_seconds_per_point":null,"status":"not_available","validation":null,"wall_seconds_per_point":null},"measurement_spec":{"accuracy":"full","backend":"jit","execution_mode":"recurrence","jit_optimization_level":2,"model":"ufo_sm"},"n_final":3,"process":"d d~ > z z z","process_key":"dd_zzz_jets","variant":null,"workload":"contracted"},{"cell_id":"matrix-recurrence-ufo-sm-full-n3-gg-gluons-contracted","measurement":{"artifact"